{
  "id": "rhythm.sync_window",
  "name": "Sync Window",
  "aliases": [
    "sync window mechanic",
    "sync window system",
    "sync window"
  ],
  "category": "rhythm",
  "subcategory": "rhythm",
  "status": "draft",
  "dimensions": [
    "2D",
    "2.5D",
    "3D"
  ],
  "difficulty": {
    "design": "medium",
    "implementation": "hard",
    "tuning": "expert"
  },
  "genres": [
    "rhythm",
    "action",
    "music"
  ],
  "description": "Sync Window is a timing mechanic where player input, scoring, or simulation aligns with musical or beat-based windows.",
  "design_notes": "Sync Window should be designed around a clear player promise, a readable trigger, and a predictable result. For rhythm mechanics, the important design work is deciding when the mechanic is allowed, how much commitment it creates, what feedback confirms success, and what counter-pressure keeps it from solving every situation. Strong tuning makes the mechanic feel intentional even when it is used repeatedly or combined with adjacent systems.",
  "design_purpose": [
    "Give the player a readable way to use sync window as part of the core loop.",
    "Create meaningful choices around timing, cost, risk, positioning, or long-term planning.",
    "Connect sync window to adjacent systems so it supports the larger game design instead of acting as an isolated feature."
  ],
  "player_fantasy": "The player feels synchronized with music, timing, and responsive feedback.",
  "required_systems": [
    "audio_clock",
    "timing_window",
    "input_buffer",
    "feedback_system"
  ],
  "parameters": [
    {
      "name": "beats_per_minute",
      "type": "float",
      "typical_range": "60-220 BPM",
      "description": "Tempo used by the mechanic."
    },
    {
      "name": "perfect_window",
      "type": "float",
      "typical_range": "10-80 milliseconds",
      "description": "Timing tolerance for the best outcome."
    },
    {
      "name": "miss_penalty",
      "type": "integer",
      "typical_range": "0-100",
      "description": "Penalty applied when input falls outside accepted timing."
    }
  ],
  "common_variants": [
    "sync_window_strict_timing",
    "sync_window_forgiving_timing",
    "call_and_response",
    "score_combo_variant"
  ],
  "edge_cases": [
    "Sync Window is triggered during a scene transition, pause, respawn, or save/load boundary.",
    "Sync Window overlaps with another high-priority state such as damage, stun, dialogue, menu focus, or cutscene control.",
    "Sync Window runs at extreme frame rates, high latency, very large coordinates, or after long play sessions."
  ],
  "common_bugs": [
    "Sync Window state does not reset correctly after interruption or reload.",
    "Feedback for Sync Window plays even when the mechanic fails or is rejected.",
    "Sync Window produces different results between frame rates, platforms, or network clients."
  ],
  "balancing_notes": [
    "Make Sync Window strong enough to justify attention but limited enough that other mechanics keep their purpose.",
    "Tune costs, cooldowns, ranges, and feedback together; changing only one number can shift the mechanic from optional to dominant."
  ],
  "accessibility_notes": [
    "Provide clear visual, audio, or haptic feedback when Sync Window becomes available, succeeds, or fails.",
    "Avoid relying on a single sensory cue or extremely narrow timing unless the game offers assists or alternate settings."
  ],
  "implementation_notes": {
    "unity": "Implement Sync Window with engine-agnostic state first, then bind it to MonoBehaviour, CharacterController, Rigidbody, UI Toolkit, or Netcode systems as appropriate.",
    "godot": "Model Sync Window as a node or resource-driven state and update deterministic pieces from _physics_process when timing or collision matters.",
    "unreal": "Implement Sync Window with Actor Components, CharacterMovement, Gameplay Ability System, UMG, or replicated gameplay state depending on the mechanic scope.",
    "web": "Implement Sync Window as data-owned state updated from the main loop; keep rendering, input, and simulation boundaries explicit for Canvas, Phaser, Three.js, or custom JavaScript."
  },
  "related_mechanics": [
    "rhythm.beat_matching",
    "rhythm.note_lane",
    "time.rhythm_timing",
    "ui_ux.damage_numbers"
  ],
  "combines_well_with": [
    "rhythm.combo_multiplier",
    "time.rhythm_timing",
    "ui_ux.damage_numbers"
  ],
  "example_games": [],
  "tags": [
    "rhythm",
    "sync",
    "timing"
  ],
  "source_confidence": "medium",
  "last_updated": "2026-06-29"
}
