{
  "id": "puzzle.portal_pair",
  "name": "Portal Pair",
  "aliases": [
    "linked portals",
    "teleport pair",
    "spatial portal"
  ],
  "category": "puzzle",
  "subcategory": "spatial_mapping",
  "status": "draft",
  "dimensions": [
    "2D",
    "2.5D",
    "3D"
  ],
  "difficulty": {
    "design": "hard",
    "implementation": "expert",
    "tuning": "hard"
  },
  "genres": [
    "puzzle",
    "platformer",
    "adventure",
    "first_person"
  ],
  "description": "Two linked surfaces or volumes remap position, velocity, orientation, visibility, or objects across space.",
  "design_notes": "Portal pairs depend on transform mapping and loop prevention. The design should define portal_pair_id ownership, allowed body classes, teleport exit correction, camera orientation, cooldown after transfer, and how portals interact with projectiles, physics objects, saves, and moving platforms.",
  "design_purpose": [
    "Create spatial reasoning puzzles based on non-local movement and line of sight.",
    "Let players redirect momentum, objects, projectiles, or visibility between separated spaces.",
    "Support compact levels that feel larger through transform mapping."
  ],
  "player_fantasy": "The player feels they can bend space and solve routes by thinking through linked surfaces.",
  "required_systems": [
    "portal_transform_mapping",
    "collision_detection",
    "camera_controller",
    "physics_state_transfer",
    "loop_prevention"
  ],
  "parameters": [
    {
      "name": "portal_pair_id",
      "type": "string",
      "typical_range": "blue_orange_pair, door_pair_03, wormhole_a",
      "description": "Stable identifier connecting entry and exit portals."
    },
    {
      "name": "entry_portal_id",
      "type": "string",
      "typical_range": "portal_blue, gate_a_front",
      "description": "Portal endpoint that detects entering bodies and computes source transform."
    },
    {
      "name": "exit_portal_id",
      "type": "string",
      "typical_range": "portal_orange, gate_a_back",
      "description": "Linked endpoint that receives mapped bodies and camera orientation."
    },
    {
      "name": "teleport_lockout_ms",
      "type": "integer",
      "typical_range": "50-500 ms",
      "description": "Short lockout that prevents immediate re-entry loops after a transfer."
    },
    {
      "name": "exit_clearance_policy_id",
      "type": "string",
      "typical_range": "sweep_to_safe_pose, block_if_occupied, push_out",
      "description": "Rule used when the exit volume is obstructed or overlaps a body."
    },
    {
      "name": "orientation_mapping_mode",
      "type": "string",
      "typical_range": "preserve_local, align_exit_normal, two_dimensional_flip",
      "description": "Mapping rule for view direction, velocity, and character facing."
    }
  ],
  "common_variants": [
    "bidirectional_portal_pair",
    "one_way_portal",
    "object_only_portal",
    "projectile_portal",
    "screen_wrap_portal"
  ],
  "edge_cases": [
    "An object is partially inside the portal and collides with both rooms during the same step.",
    "Two portals face each other and create an infinite transfer loop.",
    "The exit portal moves, rotates, or becomes blocked while a body is crossing.",
    "A save occurs while a player or object is mid-transfer."
  ],
  "common_bugs": [
    "Velocity is mapped but angular velocity, camera pitch, or carried objects are not.",
    "Teleport lockout is global and prevents other actors from using the portal pair.",
    "Collision correction pushes the player back into the entry portal and causes flicker.",
    "Portal rendering shows the correct view but authority collision still uses old room coordinates."
  ],
  "balancing_notes": [
    "Portals are easier to reason about when entry and exit surfaces have strong visual identity.",
    "Momentum-preserving portals create expressive solutions but require larger safety margins around exits.",
    "If portals carry enemies or projectiles, combat difficulty can change sharply."
  ],
  "accessibility_notes": [
    "Offer comfort options for sudden camera rotation, FOV shifts, and rapid visual recursion.",
    "Use labels, colors plus shapes, or directional arrows so linked endpoints are identifiable."
  ],
  "implementation_notes": {
    "unity": "Use trigger volumes for endpoints and map transforms through portal-local matrices. Transfer Rigidbody velocity and angular velocity, CharacterController state, camera orientation, and carried object references in one transaction with per-body teleport lockout.",
    "godot": "Represent each endpoint as an Area node with a linked portal_pair_id. Use Transform2D or Transform3D mapping for pose and velocity, and apply exit_clearance_policy_id before committing the new transform.",
    "unreal": "Use portal actors with scene capture or custom rendering for view, but keep gameplay transfer in server or authoritative movement code. CharacterMovement needs correction for orientation, velocity, and penetration at the exit.",
    "web": "In Phaser or Three.js, keep portals as simulation volumes with transform mapping separate from rendering tricks. Store per-object lockout and last portal id to prevent re-entry loops."
  },
  "related_mechanics": [
    "traversal.teleport_blink",
    "time.time_rewind",
    "physics.moving_platform",
    "camera.first_person_camera"
  ],
  "combines_well_with": [
    "puzzle.pressure_plate",
    "puzzle.mirror_light_reflection",
    "combat.projectile_reflection",
    "camera.dynamic_fov"
  ],
  "example_games": [
    {
      "title": "Portal",
      "note": "Uses paired portals for spatial reasoning and momentum puzzles."
    },
    {
      "title": "The Talos Principle",
      "note": "Uses connector-style spatial and line-of-sight logic in puzzle spaces."
    }
  ],
  "tags": [
    "portal",
    "transform_mapping",
    "teleport",
    "loop_prevention",
    "spatial_puzzle"
  ],
  "source_confidence": "medium",
  "last_updated": "2026-06-29"
}
