{
  "id": "camera.dynamic_fov",
  "name": "Dynamic Field of View",
  "aliases": [
    "dynamic fov mechanic",
    "dynamic fov system",
    "dynamic field of view"
  ],
  "category": "camera",
  "subcategory": "view_control",
  "status": "draft",
  "dimensions": [
    "2D",
    "2.5D",
    "3D"
  ],
  "difficulty": {
    "design": "medium",
    "implementation": "medium",
    "tuning": "medium"
  },
  "genres": [
    "action",
    "adventure",
    "simulation"
  ],
  "description": "Dynamic Field of View is a viewpoint behavior that frames action and communicates spatial information to the player.",
  "design_notes": "Dynamic Field of View should be designed around a clear player promise, a readable trigger, and a predictable result. For camera mechanics, the important design work is deciding when the mechanic is allowed, how much commitment it creates, what feedback confirms success, and what counter-pressure keeps it from solving every situation. Strong tuning makes the mechanic feel intentional even when it is used repeatedly or combined with adjacent systems.",
  "design_purpose": [
    "Give the player a readable way to use dynamic field of view as part of the core loop.",
    "Create meaningful choices around timing, cost, risk, positioning, or long-term planning.",
    "Connect dynamic field of view to adjacent systems so it supports the larger game design instead of acting as an isolated feature."
  ],
  "player_fantasy": "The player feels oriented and confident because the game frames what matters.",
  "required_systems": [
    "camera_controller",
    "target_tracking",
    "smoothing",
    "screen_bounds"
  ],
  "parameters": [
    {
      "name": "follow_lag",
      "type": "float",
      "typical_range": "0-0.5 seconds",
      "description": "How far behind the target the camera is allowed to feel."
    },
    {
      "name": "framing_offset",
      "type": "vector",
      "typical_range": "0-40% of screen",
      "description": "Offset used to keep the important subject away from dead center."
    },
    {
      "name": "transition_speed",
      "type": "float",
      "typical_range": "0.1-5.0 seconds",
      "description": "How quickly the camera blends to the new behavior."
    }
  ],
  "common_variants": [
    "dynamic_fov_fixed_mode",
    "dynamic_fov_player_controlled_mode",
    "context_sensitive_mode",
    "cinematic_mode"
  ],
  "edge_cases": [
    "Dynamic Field of View is triggered during a scene transition, pause, respawn, or save/load boundary.",
    "Dynamic Field of View overlaps with another high-priority state such as damage, stun, dialogue, menu focus, or cutscene control.",
    "Dynamic Field of View runs at extreme frame rates, high latency, very large coordinates, or after long play sessions."
  ],
  "common_bugs": [
    "Dynamic Field of View state does not reset correctly after interruption or reload.",
    "Feedback for Dynamic Field of View plays even when the mechanic fails or is rejected.",
    "Dynamic Field of View produces different results between frame rates, platforms, or network clients."
  ],
  "balancing_notes": [
    "Make Dynamic Field of View strong enough to justify attention but limited enough that other mechanics keep their purpose.",
    "Tune costs, cooldowns, ranges, and feedback together; changing only one number can shift the mechanic from optional to dominant."
  ],
  "accessibility_notes": [
    "Provide clear visual, audio, or haptic feedback when Dynamic Field of View becomes available, succeeds, or fails.",
    "Avoid relying on a single sensory cue or extremely narrow timing unless the game offers assists or alternate settings."
  ],
  "implementation_notes": {
    "unity": "Implement Dynamic Field of View with engine-agnostic state first, then bind it to MonoBehaviour, CharacterController, Rigidbody, UI Toolkit, or Netcode systems as appropriate.",
    "godot": "Model Dynamic Field of View as a node or resource-driven state and update deterministic pieces from _physics_process when timing or collision matters.",
    "unreal": "Implement Dynamic Field of View with Actor Components, CharacterMovement, Gameplay Ability System, UMG, or replicated gameplay state depending on the mechanic scope.",
    "web": "Implement Dynamic Field of View as data-owned state updated from the main loop; keep rendering, input, and simulation boundaries explicit for Canvas, Phaser, Three.js, or custom JavaScript."
  },
  "related_mechanics": [
    "camera.first_person_camera",
    "camera.smooth_follow_camera",
    "combat.lock_on_targeting",
    "movement.run"
  ],
  "combines_well_with": [
    "camera.third_person_camera",
    "camera.top_down_camera",
    "combat.lock_on_targeting",
    "movement.run"
  ],
  "example_games": [],
  "tags": [
    "camera",
    "dynamic",
    "readability",
    "view_control"
  ],
  "source_confidence": "medium",
  "last_updated": "2026-06-29"
}
