{
  "id": "movement.dodge_roll",
  "name": "Dodge Roll",
  "aliases": [
    "combat roll",
    "evasive roll",
    "roll dodge"
  ],
  "category": "movement",
  "subcategory": "burst_movement",
  "status": "draft",
  "dimensions": [
    "2D",
    "2.5D",
    "3D"
  ],
  "difficulty": {
    "design": "easy",
    "implementation": "easy",
    "tuning": "medium"
  },
  "genres": [
    "platformer",
    "action",
    "adventure"
  ],
  "description": "A committed evasive movement action that briefly changes position, hit reaction rules, and recovery timing, often with invulnerability frames.",
  "design_notes": "Dodge roll sits between movement and defense. Define the active invulnerability window, recovery frames, direction capture, collision shape, and cancel rules before tuning displacement. It should reward anticipation and positioning without becoming a universal answer to every attack pattern.",
  "design_purpose": [
    "Give players a defensive repositioning tool with readable commitment and recovery.",
    "Create timing skill around attack telegraphs, invulnerability, and spacing.",
    "Connect movement, stamina, combat, and animation locks through one evasive action."
  ],
  "player_fantasy": "The player feels nimble under pressure, narrowly avoiding danger while committing to a visible recovery.",
  "required_systems": [
    "movement_state_machine",
    "damage_immunity",
    "animation_events",
    "collision_capsule",
    "input_buffer"
  ],
  "parameters": [
    {
      "name": "roll_displacement_units",
      "type": "float",
      "typical_range": "2-6 world units",
      "description": "Horizontal displacement target before collision truncation."
    },
    {
      "name": "dodge_roll_i_frames_ms",
      "type": "integer",
      "typical_range": "80-300 ms",
      "description": "Milliseconds of eligible damage immunity inside the roll."
    },
    {
      "name": "dodge_roll_recovery_ms",
      "type": "integer",
      "typical_range": "150-600 ms",
      "description": "Post-movement lockout before ordinary actions resume."
    },
    {
      "name": "roll_input_buffer_ms",
      "type": "integer",
      "typical_range": "50-180 ms",
      "description": "Queued input window before roll activation becomes legal."
    },
    {
      "name": "roll_stamina_drain_units",
      "type": "float",
      "typical_range": "10-35 units",
      "description": "Stamina resource consumed on accepted roll activation."
    },
    {
      "name": "roll_capsule_profile_id",
      "type": "string",
      "typical_range": "standing, compact, prone_like",
      "description": "Collision profile used during active roll frames."
    }
  ],
  "common_variants": [
    "i_frame_roll",
    "directional_roll",
    "fat_roll",
    "quickstep",
    "stamina_roll"
  ],
  "edge_cases": [
    "Roll direction should be captured at activation, not drift when lock-on target or camera heading changes mid-roll.",
    "Incoming damage during the first or last roll frame needs consistent inclusive or exclusive immunity rules.",
    "Rolling into stairs, ledges, or narrow doors must not leave the character inside collision after recovery.",
    "Networked rolls need server authority for immunity and correction for predicted displacement."
  ],
  "common_bugs": [
    "Invulnerability is tied to animation events and desyncs when animation playback rate changes.",
    "Roll hits the same hazard twice because damage immunity and hurtbox state are not updated atomically.",
    "Input buffering triggers a roll after stun recovery even though the player released the button long ago.",
    "Capsule profile changes are not restored after interrupt, leaving the character permanently compact."
  ],
  "balancing_notes": [
    "Long i-frame windows make roll a timing solution; long displacement makes it a spacing solution.",
    "Recovery frames are the main counterweight when roll is used in combat, especially against repeated attacks.",
    "Stamina cost should reflect how often encounters require rolling rather than only the roll displacement."
  ],
  "accessibility_notes": [
    "Use generous input buffering and readable attack telegraphs if roll timing is central to survival.",
    "Consider assist settings that widen dodge_roll_i_frames_ms or reduce repeated-button strain."
  ],
  "implementation_notes": {
    "unity": "Create a roll state with activation tick, captured direction, immunity interval, and recovery interval. Drive displacement from FixedUpdate with swept collision; damage queries should read dodge_roll_i_frames_ms from state, not from Animator timing alone.",
    "godot": "Store roll_state on the character and update velocity in _physics_process. Use animation callbacks only to request visual transitions; collision profile and invulnerability should be changed by deterministic state ticks.",
    "unreal": "Implement roll as a Gameplay Ability or custom CharacterMovement state. Server validates stamina and immunity windows, while predicted clients play the montage and reconcile displacement when authoritative movement arrives.",
    "web": "Represent roll as an immutable action instance with activation_tick, direction, displacement, and recovery. Resolve per-target damage immunity before collision and animation rendering."
  },
  "related_mechanics": [
    "combat.invincibility_frames",
    "movement.dash",
    "movement.stamina_movement",
    "combat.hit_stun"
  ],
  "combines_well_with": [
    "combat.parry",
    "ui_ux.cooldown_indicator",
    "camera.screen_shake",
    "survival.stamina"
  ],
  "example_games": [
    {
      "title": "Dark Souls",
      "note": "Uses dodge rolling as a core defensive timing and positioning action."
    },
    {
      "title": "Enter the Gungeon",
      "note": "Uses dodge roll for projectile evasion with committed recovery."
    }
  ],
  "tags": [
    "dodge_roll",
    "i_frames",
    "recovery_frames",
    "stamina",
    "evasion"
  ],
  "source_confidence": "medium",
  "last_updated": "2026-06-29"
}
