{
  "id": "physics.low_gravity_zone",
  "name": "Low-Gravity Zone",
  "aliases": [
    "low gravity zone mechanic",
    "low gravity zone system",
    "low-gravity zone"
  ],
  "category": "physics",
  "subcategory": "simulation_force",
  "status": "draft",
  "dimensions": [
    "2D",
    "2.5D",
    "3D"
  ],
  "difficulty": {
    "design": "medium",
    "implementation": "hard",
    "tuning": "hard"
  },
  "genres": [
    "puzzle",
    "sandbox",
    "simulation"
  ],
  "description": "Low-Gravity Zone is a world-system mechanic driven by forces, constraints, collision response, or simulated motion.",
  "design_notes": "Low-Gravity Zone should be designed around a clear player promise, a readable trigger, and a predictable result. For physics mechanics, the important design work is deciding when the mechanic is allowed, how much commitment it creates, what feedback confirms success, and what counter-pressure keeps it from solving every situation. Strong tuning makes the mechanic feel intentional even when it is used repeatedly or combined with adjacent systems.",
  "design_purpose": [
    "Give the player a readable way to use low-gravity zone as part of the core loop.",
    "Create meaningful choices around timing, cost, risk, positioning, or long-term planning.",
    "Connect low-gravity zone to adjacent systems so it supports the larger game design instead of acting as an isolated feature."
  ],
  "player_fantasy": "The player feels the world has weight, motion, and consequences.",
  "required_systems": [
    "physics_world",
    "collision_detection",
    "rigidbody_or_constraint_system",
    "event_dispatch"
  ],
  "parameters": [
    {
      "name": "force_strength",
      "type": "float",
      "typical_range": "0.1-1000 units",
      "description": "Magnitude of the force, impulse, or constraint effect."
    },
    {
      "name": "mass_or_weight",
      "type": "float",
      "typical_range": "0.1-500 units",
      "description": "Mass scale used by collision and force calculations."
    },
    {
      "name": "damping",
      "type": "float",
      "typical_range": "0-1",
      "description": "How quickly motion loses energy over time."
    }
  ],
  "common_variants": [
    "low_gravity_zone_scripted_version",
    "low_gravity_zone_fully_simulated_version",
    "network_synced_version",
    "puzzle_variant"
  ],
  "edge_cases": [
    "Low-Gravity Zone is triggered during a scene transition, pause, respawn, or save/load boundary.",
    "Low-Gravity Zone overlaps with another high-priority state such as damage, stun, dialogue, menu focus, or cutscene control.",
    "Low-Gravity Zone runs at extreme frame rates, high latency, very large coordinates, or after long play sessions."
  ],
  "common_bugs": [
    "Low-Gravity Zone state does not reset correctly after interruption or reload.",
    "Feedback for Low-Gravity Zone plays even when the mechanic fails or is rejected.",
    "Low-Gravity Zone produces different results between frame rates, platforms, or network clients."
  ],
  "balancing_notes": [
    "Make Low-Gravity Zone strong enough to justify attention but limited enough that other mechanics keep their purpose.",
    "Tune costs, cooldowns, ranges, and feedback together; changing only one number can shift the mechanic from optional to dominant."
  ],
  "accessibility_notes": [
    "Provide clear visual, audio, or haptic feedback when Low-Gravity Zone becomes available, succeeds, or fails.",
    "Avoid relying on a single sensory cue or extremely narrow timing unless the game offers assists or alternate settings."
  ],
  "implementation_notes": {
    "unity": "Implement Low-Gravity Zone with engine-agnostic state first, then bind it to MonoBehaviour, CharacterController, Rigidbody, UI Toolkit, or Netcode systems as appropriate.",
    "godot": "Model Low-Gravity Zone as a node or resource-driven state and update deterministic pieces from _physics_process when timing or collision matters.",
    "unreal": "Implement Low-Gravity Zone with Actor Components, CharacterMovement, Gameplay Ability System, UMG, or replicated gameplay state depending on the mechanic scope.",
    "web": "Implement Low-Gravity Zone as data-owned state updated from the main loop; keep rendering, input, and simulation boundaries explicit for Canvas, Phaser, Three.js, or custom JavaScript."
  },
  "related_mechanics": [
    "physics.buoyancy",
    "physics.gravity",
    "puzzle.physics_weight_puzzle",
    "simulation.systemic_weather"
  ],
  "combines_well_with": [
    "physics.moving_platform",
    "physics.wind_force",
    "puzzle.physics_weight_puzzle",
    "simulation.systemic_weather"
  ],
  "example_games": [],
  "tags": [
    "low",
    "physics",
    "simulation",
    "simulation_force"
  ],
  "source_confidence": "medium",
  "last_updated": "2026-06-29"
}
